Incident-id,Date(dd/mm/yr),Animal,village,District,State,Victim age,Victim outcome,Incident details,Source url,Unnamed: 10,Unnamed: 11,Unnamed: 12,Unnamed: 13,Unnamed: 14,Unnamed: 15,Unnamed: 16,Unnamed: 17,Unnamed: 18,Unnamed: 19,Unnamed: 20,Unnamed: 21,Unnamed: 22,Unnamed: 23,Unnamed: 24,Unnamed: 25,Unnamed: 26,Unnamed: 27,Unnamed: 28,Unnamed: 29,Unnamed: 30,Unnamed: 31,Unnamed: 32,Unnamed: 33,Unnamed: 34,Unnamed: 35,Unnamed: 36,Unnamed: 37,Unnamed: 38,Unnamed: 39,Unnamed: 40,Unnamed: 41,Unnamed: 42,Unnamed: 43,Unnamed: 44,Unnamed: 45,Unnamed: 46,Unnamed: 47,Unnamed: 48,Unnamed: 49,Unnamed: 50,Unnamed: 51,Unnamed: 52,Unnamed: 53,Unnamed: 54,Unnamed: 55,lat,lon
277,12-11-23,leopard,brooklands,nilgiris,Tamil nadu,--,injured,"Six people, including a journalist who was covering the rescue operation, were injured after a leopard attack in Brookland near Coonoor ","Tamil Nadu: Six injured after leopard attack in Nilgiris district, containment op underway",,,,,,,,,,,,,,,,,,,,,,,,,,,,,,,,,,,,,,,,,,,,,,,,
278,09-02-23,leopard,raj nagar,ghaziabad,Uttar pradesh,--,injured,A leopard entered the Ghaziabad court complex and attacked at least eight people ,"Leopard enters Ghaziabad court complex, 8 injured in attack | Delhi News - The Indian Express",,,,,,,,,,,,,,,,,,,,,,,,,,,,,,,,,,,,,,,,,,,,,,,,
279,08-06-23,leopard,goghamba,panchmahal,Gujarat,11yr,injured,The boy was sleeping on a cot outside his house in the village when the leopard attacked the child,"11-year-old attacked by leopard, suffers head injuries | Ahmedabad News - The Indian Express",,,,,,,,,,,,,,,,,,,,,,,,,,,,,,,,,,,,,,,,,,,,,,,,
280,31/01/23,leopard,bodeli,chota udepur,Gujarat,2yr,Dead,The leopard santched the kid and ran into bushes,Two kids succumb to leopard attacks in Gujarat | DeshGujarat,,,,,,,,,,,,,,,,,,,,,,,,,,,,,,,,,,,,,,,,,,,,,,,,
281,29/12/24,Elephant,vannappuram,idukki,Kerala,22yr,Dead,He was killed in an elephant attack near Kothamangalam forest range while untying his cattle in a teak plantation,22-year-old killed in elephant attack near Kothamangalam forest range | Idukki News,,,,,,,,,,,,,,,,,,,,,,,,,,,,,,,,,,,,,,,,,,,,,,,,
282,30/11/24,Tiger,nazrulnagar ,kumuram bheem asifabad,Telangana,21yr,Dead,She  lost her life in a tiger attack while working in an agricultural field,"21-year-old woman dies in tiger attack at Kagaznagar, Telangana",,,,,,,,,,,,,,,,,,,,,,,,,,,,,,,,,,,,,,,,,,,,,,,,
283,24/12/22,Tiger,ramnagar,nainital,Uttarakhand,--,Dead,A tiger attacked three local men drinking in the Corbett-Ramnagar forest area killing one of them.,Corbett: Jim Corbett Tiger Attack: Tiger on prowl kills one of three men drinking in Jim Corbett | Dehradun News - Times of India,,,,,,,,,,,,,,,,,,,,,,,,,,,,,,,,,,,,,,,,,,,,,,,,
284,24/05/22,Tiger,talodhi,chandrapur,Maharastra,50yr,Dead,She had gone to collect tendu leaves in the forest under t ange was killed by a tiger,Tiger kills couple in Talodhi forest | Nagpur News - Times of India,,,,,,,,,,,,,,,,,,,,,,,,,,,,,,,,,,,,,,,,,,,,,,,,
285,03-05-22,Tiger,usegaon,gadchiroli,Maharastra,21yr,Dead,He was in forest when attack happened,"Tiger kills youth inside forest, injures girlfriend | Nagpur News - Times of India",,,,,,,,,,,,,,,,,,,,,,,,,,,,,,,,,,,,,,,,,,,,,,,,
286,03-05-22,Tiger,usegaon,gadchiroli,Maharastra,20yr,injured,She was in forest when attack happened,"Tiger kills youth inside forest, injures girlfriend | Nagpur News - Times of India",,,,,,,,,,,,,,,,,,,,,,,,,,,,,,,,,,,,,,,,,,,,,,,,
287,21/12/22,Tiger,kedarlingwad,kolhapur,Maharastra,10yr,Dead,The girl had went along with her mother for grazing the cattle and the leopard attacked upon her from behind while they were returning back towards their makeshift hut,10-year-old killed in leopard attack in Maharashtra's Kolhapur | Kolhapur News - Times of India,,,,,,,,,,,,,,,,,,,,,,,,,,,,,,,,,,,,,,,,,,,,,,,,
288,29/07/22,leopard,vavkundali,panchmahal,Gujarat,8month,Dead,The incident took place late night his mother was breastfeeding her eight-month-old son inside their hut,Gujarat: 8-month-old child dragged away by leopard from mothers lap found dead | Gandhinagar News - The Indian Express,,,,,,,,,,,,,,,,,,,,,,,,,,,,,,,,,,,,,,,,,,,,,,,,
289,01-05-22,leopard,durgapur,chandrapur,Maharastra,47yr,Dead,A woman was killed by a leopard in the front yard of her house in Durgapur village,"Leopard kills woman in Durgapur, shepherd dies in tiger attack | Nagpur News - Times of India",,,,,,,,,,,,,,,,,,,,,,,,,,,,,,,,,,,,,,,,,,,,,,,,
290,30/04/22,Tiger,maroda,chandrapur,Maharastra,60yr,Dead,He had taken his oxen for grazing to his farm near the village when the attacked happened,"Leopard kills woman in Durgapur, shepherd dies in tiger attack | Nagpur News - Times of India",,,,,,,,,,,,,,,,,,,,,,,,,,,,,,,,,,,,,,,,,,,,,,,,
291,06-12-24,Tiger,kurkheda,gadchiroli,Maharastra,24yr,Dead,She had gone to field to collect paddy after thresing when the tiger attacked her,https://www.lokmattimes.com/maharashtra/tiger-attack-in-maharashtra-pregnant-woman-mauled-to-death-by-big-cat-in-gadchiroli-a517/,,,,,,,,,,,,,,,,,,,,,,,,,,,,,,,,,,,,,,,,,,,,,,,,
292,30/11/24,Tiger,dubbaguda,kumuram bheem asifabad,Telangana,--,injured,"The  farmer had gone to his field to carry out his daily work. As he was going about his routine, the tiger struck him, severely injuring his neck.",Another tiger attack in Telangana's Adilabad leaves man injured,,,,,,,,,,,,,,,,,,,,,,,,,,,,,,,,,,,,,,,,,,,,,,,,
293,14/05/25,Tiger,karbada,chandrapur,Maharastra,54yr,Dead,"The woman went ?into the forest near Karbada village to collect tendu leaves,when a tiger tiger hiding in the bushes suddenly pounced on her","Tiger mauls another woman in Chandrapur, sixth death in five days | Mumbai news",,,,,,,,,,,,,,,,,,,,,,,,,,,,,,,,,,,,,,,,,,,,,,,,
294,15/10/24,Tiger,jamunia,nagpur,Maharastra,55yr,Dead,He was attacked by the big cat when he was headed towards his farm to guard crops,"Man killed in tiger attack, villagers damage forest department vehicle",,,,,,,,,,,,,,,,,,,,,,,,,,,,,,,,,,,,,,,,,,,,,,,,
295,19/09/24,Tiger,mul,chandrapur,Maharastra,--,Dead,He s had gone to forests for grazing cattle when a lurking tiger suddenly attacked and killed him,Tiger kills shepherd in Chandrapur district; 6th such incident in two months,,,,,,,,,,,,,,,,,,,,,,,,,,,,,,,,,,,,,,,,,,,,,,,,
296,15/05/24,Tiger,khangao,chandrapur,Maharastra,33yr,Dead,"During an overnight vigil on standing crop, the farmer fell prey to a tiger, which dragged his dismembered body to an adjacent jungle","Tiger: Tiger devours Chimur farmer, 9th in Chandrapur this year | Nagpur News - Times of India",,,,,,,,,,,,,,,,,,,,,,,,,,,,,,,,,,,,,,,,,,,,,,,,
297,14/03/24,Tiger,ballapur range,chandrapur,Maharastra,58yr,Dead,The incident took place in forest area number 494 in Ballarpur range when the victim had gone to collect wood,58-Year-Old Man Killed In Tiger Attack In Maharashtra,,,,,,,,,,,,,,,,,,,,,,,,,,,,,,,,,,,,,,,,,,,,,,,,
298,11-08-24,Tiger,pench,seoni,Madhya pradesh,--,injured,While he was guiding the livestock he was attacked,Pench Tiger Reserve: How a Man Survived a Tiger Attack,,,,,,,,,,,,,,,,,,,,,,,,,,,,,,,,,,,,,,,,,,,,,,,,
299,02-11-24,Elephant,bandhavgarh,umaria,Madhya pradesh,65yr,Dead,The wild elephants trampled him to death outside the bandhavgarh reserve,Man killed in elephant attack near MP's Bandhavgarh Tiger Reserve | India News - Times of India,,,,,,,,,,,,,,,,,,,,,,,,,,,,,,,,,,,,,,,,,,,,,,,,
300,21/12/24,Tiger,kaliabor,nagaon,Assam,60yr,Dead,The man had entered the jungle along with some others and was attacked,Man dies in suspected tiger attack in Assam's Kaliabor,,,,,,,,,,,,,,,,,,,,,,,,,,,,,,,,,,,,,,,,,,,,,,,,
301,23-03-2024,Sloth Bear,Anakapalle,Srikakulam,Andhra Pradesh,50yr,Dead,Two farmers were attacked while working in a cashew orchard. One victim was dragged from a tractor by the bear.,https://www.newindianexpress.com/states/andhra-pradesh/2024/Mar/24/sloth-bear-mauls-two-ryots-to-death-in-andhra-pradeshs-srikakulam,,,,,,,,,,,,,,,,,,,,,,,,,,,,,,,,,,,,,,,,,,,,,,,,
302,04-08-2024,Sloth Bear,Badraudi,Gaurela-Pendra-Marwahi,Chhattisgarh,28yr,Dead,Child was playing outside staff quarters in a tea estate during evening hours.,https://www.republicworld.com/india/wild-sloth-bear-mauls-28-year-old-man-to-death-in-chhattisgarh-2-others-critically-injured,,,,,,,,,,,,,,,,,,,,,,,,,,,,,,,,,,,,,,,,,,,,,,,,
303,11-08-2025,Sloth Bear,Waverly Estate,Coimbatore (Valparai),Tamil Nadu,8yr,Dead,The child was the son of a migrant worker; attacked while returning home after buying milk in a tea estate area,https://www.thenewsminute.com/tamil-nadu/boy-killed-by-sloth-bear-in-valparai-in-tamil-nadu,,,,,,,,,,,,,,,,,,,,,,,,,,,,,,,,,,,,,,,,,,,,,,,,
304,27-08-2025,Sloth Bear,Turunga,Jajpur,Odisha,27yr,Dead,Victim was attacked while attending to nature's call in a forest patch. He succumbed to injuries days later in Sept 2025.,https://timesofindia.indiatimes.com/city/bhubaneswar/man-from-jajpur-district-dies-days-after-getting-injured-in-sloth-bear-attack/articleshow/123837806.cms,,,,,,,,,,,,,,,,,,,,,,,,,,,,,,,,,,,,,,,,,,,,,,,,
305,27-09-2024,Sloth Bear,Beljhiriya,Gaurela-Pendra-Marwahi,Chhattisgarh,13yr,Dead,A minor girl was attacked and killed while grazing goats in the village fields.,https://timesofindia.indiatimes.com/city/raipur/minor-girl-man-mauled-to-death-by-sloth-bear/articleshow/113771475.cms,,,,,,,,,,,,,,,,,,,,,,,,,,,,,,,,,,,,,,,,,,,,,,,,
306,27-07-2025,Sloth Bear,Yelagiri Hills (12th Hairpin Bend),Tirupattur,Tamil nadu,50yr,injured,A coconut trader riding a two-wheeler hit a bear crossing the road at a hairpin bend and was attacked in defense.,https://www.thehindu.com/news/national/tamil-nadu/sloth-bear-attacks-motorist-in-yelagiri-hills-forest-officials-issue-guidelines/article69858382.ece,,,,,,,,,,,,,,,,,,,,,,,,,,,,,,,,,,,,,,,,,,,,,,,,
307,22-09-2024,Sloth Bear,Sirukundra Estate,Coimbatore (Valparai),Tamil Nadu,25yr,injured,A migrant worker from Jharkhand was attacked on his hand and leg while working in a tea estate.,https://www.thehindu.com/news/cities/Coimbatore/migrant-worker-attacked-by-sloth-bear-near-valparai/article68670896.ece,,,,,,,,,,,,,,,,,,,,,,,,,,,,,,,,,,,,,,,,,,,,,,,,
308,16-09-2025,Sloth Bear,Khanua-Jamgadi,Singrauli,Madhya Pradesh,45yr,Dead,Victim (Guest Teacher) was grazing goats in the forest when attacked. Another man (45) tried to save him and was also killed.,https://www.newindianexpress.com/nation/2025/Sep/20/female-sloth-bear-that-killed-two-men-in-singrauli-found-dead-forensic-analysis-ordered-to-determine-cause,,,,,,,,,,,,,,,,,,,,,,,,,,,,,,,,,,,,,,,,,,,,,,,,
309,12-08-2025,Sloth Bear,Waverly Estate,Coimbatore (Valparai),Tamil nadu,8yr,Dead,Child was sent to buy milk at a shop 200m away; bear attacked from bushes. Nail marks confirmed bear species.,https://www.newindianexpress.com/states/tamil-nadu/2025/Aug/12/sloth-bear-kills-eight-year-old-boy-in-anamalai-tiger-reserve-second-child-death-in-two-months,,,,,,,,,,,,,,,,,,,,,,,,,,,,,,,,,,,,,,,,,,,,,,,,
310,07-08-2025,Sloth Bear,Near Western Ghats,Tenkasi (Puliyangudi),Tamil nadu,52yr,injured,Three women farm workers attacked at 9 AM while working in a private farm near the foothills.,https://www.thehindu.com/news/national/tamil-nadu/three-women-farm-workers-injured-in-sloth-bear-attack-near-puliyangudi-residents-stage-protest/article69904428.ece,,,,,,,,,,,,,,,,,,,,,,,,,,,,,,,,,,,,,,,,,,,,,,,,
311,07-08-2025,Sloth Bear,Near Western Ghats,Tenkasi (Puliyangudi),Tamil nadu,43yr,injured,Three women farm workers attacked at 9 AM while working in a private farm near the foothills.,https://www.thehindu.com/news/national/tamil-nadu/three-women-farm-workers-injured-in-sloth-bear-attack-near-puliyangudi-residents-stage-protest/article69904428.ece,,,,,,,,,,,,,,,,,,,,,,,,,,,,,,,,,,,,,,,,,,,,,,,,
312,07-08-2025,Sloth Bear,Near Western Ghats,Tenkasi (Puliyangudi),Tamil nadu,44yr,injured,Three women farm workers attacked at 9 AM while working in a private farm near the foothills.,https://www.thehindu.com/news/national/tamil-nadu/three-women-farm-workers-injured-in-sloth-bear-attack-near-puliyangudi-residents-stage-protest/article69904428.ece,,,,,,,,,,,,,,,,,,,,,,,,,,,,,,,,,,,,,,,,,,,,,,,,
313,27-09-2024,Sloth Bear,Beljhiriya,Gaurela-Pendra-Marwahi,Chhattisgarh,13yr,Dead,Minor girl attacked and killed while grazing goats in village fields.,https://timesofindia.indiatimes.com/city/raipur/minor-girl-man-mauled-to-death-by-sloth-bear/articleshow/113771475.cms,,,,,,,,,,,,,,,,,,,,,,,,,,,,,,,,,,,,,,,,,,,,,,,,
314,27-09-2024,Sloth Bear,Forest area,Gaurela-Pendra-Marwahi,Chhattisgarh,25yr,Dead,"In a separate incident on the same day, a man collecting forest produce was attacked and suffered fatal abdominal injuries.",https://timesofindia.indiatimes.com/city/raipur/minor-girl-man-mauled-to-death-by-sloth-bear/articleshow/113771475.cms,,,,,,,,,,,,,,,,,,,,,,,,,,,,,,,,,,,,,,,,,,,,,,,,
315,25-08-2024,Sloth Bear,Thimlapura,Shimoga (Bhadravati),Karnataka,32yr,injured,Two villagers suffered minor injuries in attacks leading up to the capture of the bear by forest officials.,https://www.thehindu.com/news/national/karnataka/forest-dept-officials-capture-sloth-bear-in-thimlapura-in-bhadravati-taluk/article68565663.ece,,,,,,,,,,,,,,,,,,,,,,,,,,,,,,,,,,,,,,,,,,,,,,,,
316,24-03-2024,Sloth Bear,Anakapalle,Srikakulam,Andhra Pradesh,50yr,Dead,Couple working in cashew orchard attacked. Neighbor on tractor tried to intervene and was dragged off and killed.,https://www.newindianexpress.com/states/andhra-pradesh/2024/Mar/24/sloth-bear-mauls-two-ryots-to-death-in-andhra-pradeshs-srikakulam,,,,,,,,,,,,,,,,,,,,,,,,,,,,,,,,,,,,,,,,,,,,,,,,
317,24-03-2024,Sloth Bear,Anakapalle,Srikakulam,Andhra Pradesh,45yr,Dead,Couple working in cashew orchard attacked. Neighbor on tractor tried to intervene and was dragged off and killed.,https://www.newindianexpress.com/states/andhra-pradesh/2024/Mar/24/sloth-bear-mauls-two-ryots-to-death-in-andhra-pradeshs-srikakulam,,,,,,,,,,,,,,,,,,,,,,,,,,,,,,,,,,,,,,,,,,,,,,,,
318,15-07-2025,Sloth Bear,Antharasanthe Range,Mysuru,Karnataka,47yr,injured,Forest watcher attacked on face and head while patrolling in Nagarahole Tiger Reserve,https://www.deccanherald.com/india/karnataka/bear-attacks-forest-watcher-in-nagarahole-tiger-reserve-3632115,,,,,,,,,,,,,,,,,,,,,,,,,,,,,,,,,,,,,,,,,,,,,,,,
319,12-07-2025,Sloth Bear,Ryavanaki,Koppal,Karnataka,60yr,injured,Victim attacked by a mother bear with two cubs while working in his farm near a residential school,https://timesofindia.indiatimes.com/city/hubballi/bear-attacks-farmer-in-koppal-village/articleshow/122408880.cms,,,,,,,,,,,,,,,,,,,,,,,,,,,,,,,,,,,,,,,,,,,,,,,,
320,02-12-2024,Sloth Bear,Mana (Khanapur),Belagavi,Karnataka,62yr,injured,Farmer attacked while walking to his field with his wife. He fought the bear with a machete but lost his leg,https://www.thehindu.com/news/national/karnataka/farmer-injured-in-bear-attack-in-belagavi-forest/article68941352.ece,,,,,,,,,,,,,,,,,,,,,,,,,,,,,,,,,,,,,,,,,,,,,,,,
321,25-08-2024,Sloth Bear,Thimlapura,Shivamogga,Karnataka,35yr,injured,Two villagers suffered minor injuries in attacks leading up to the capture of the bear by forest officials.,https://www.thehindu.com/news/national/karnataka/forest-dept-officials-capture-sloth-bear-in-thimlapura-in-bhadravati-taluk/article68565663.ece,,,,,,,,,,,,,,,,,,,,,,,,,,,,,,,,,,,,,,,,,,,,,,,,
322,25-08-2024,Sloth Bear,Thimlapura,Shivamogga,Karnataka,35yr,injured,Two villagers suffered minor injuries in attacks leading up to the capture of the bear by forest officials.,https://www.thehindu.com/news/national/karnataka/forest-dept-officials-capture-sloth-bear-in-thimlapura-in-bhadravati-taluk/article68565663.ece,,,,,,,,,,,,,,,,,,,,,,,,,,,,,,,,,,,,,,,,,,,,,,,,
323,13-05-2024,Sloth Bear,Chilakamukhi,Koppal,Karnataka,,Dead,Report confirms two people were killed in Koppal district in the preceding month (April 2024).,https://www.deccanherald.com/elections/karnataka/sloth-bear-leopard-attacks-scare-daylights-out-of-farmers-in-3-districts-of-karnataka-3021062,,,,,,,,,,,,,,,,,,,,,,,,,,,,,,,,,,,,,,,,,,,,,,,,
324,13-05-2024,Sloth Bear,Chilakamukhi,Koppal,Karnataka,,Dead,Report confirms two people were killed in Koppal district in the preceding month (April 2024).,https://www.deccanherald.com/elections/karnataka/sloth-bear-leopard-attacks-scare-daylights-out-of-farmers-in-3-districts-of-karnataka-3021062,,,,,,,,,,,,,,,,,,,,,,,,,,,,,,,,,,,,,,,,,,,,,,,,
325,23-03-2025,Sloth Bear,Pali-Sattari,Goa - KA border,Karnataka/Goa,63yr,injured,Farmer grievously injured in a bear attack while heading to fields; highlights cross-border conflict zones.,https://www.prudentmedia.in/general/sloth-bear-sighting-in-palisattari-creates-panic-among-villagers/32694.html,,,,,,,,,,,,,,,,,,,,,,,,,,,,,,,,,,,,,,,,,,,,,,,,
326,18-01-2025,Sloth Bear,Korar Forest,Kanker,Chhattisgarh,45yr,Dead,A father and son were killed. The son was attacked first; the father climbed a tree but was dragged down by the bear.,https://timesofindia.indiatimes.com/city/raipur/rabid-sloth-bear-kills-father-son-duo-injures-forest-ranger-in-kanker/articleshow/117436812.cms,,,,,,,,,,,,,,,,,,,,,,,,,,,,,,,,,,,,,,,,,,,,,,,,
327,18-01-2025,Sloth Bear,Korar Forest,Kanker,Chhattisgarh,65yr,Dead,A father and son were killed. The son was attacked first; the father climbed a tree but was dragged down by the bear.,https://timesofindia.indiatimes.com/city/raipur/rabid-sloth-bear-kills-father-son-duo-injures-forest-ranger-in-kanker/articleshow/117436812.cms,,,,,,,,,,,,,,,,,,,,,,,,,,,,,,,,,,,,,,,,,,,,,,,,
328,16-09-2025,Sloth Bear,Khanua-Jamgadi,Singrauli,Madhya pradesh,45yr,Dead,A guest teacher grazing goats was attacked. A rescuer tried to save him but was also mauled to death.,https://www.newindianexpress.com/nation/2025/Sep/20/female-sloth-bear-that-killed-two-men-in-singrauli-found-dead-forensic-analysis-ordered-to-determine-cause,,,,,,,,,,,,,,,,,,,,,,,,,,,,,,,,,,,,,,,,,,,,,,,,
329,16-09-2025,Sloth Bear,Khanua-Jamgadi,Singrauli,Madhya pradesh,45yr,Dead,A guest teacher grazing goats was attacked. A rescuer tried to save him but was also mauled to death.,https://www.newindianexpress.com/nation/2025/Sep/20/female-sloth-bear-that-killed-two-men-in-singrauli-found-dead-forensic-analysis-ordered-to-determine-cause,,,,,,,,,,,,,,,,,,,,,,,,,,,,,,,,,,,,,,,,,,,,,,,,
330,28-09-2024,Sloth Bear,Beljhiriya,GPM District,Chhattisgarh,13yr,Dead,A minor girl was attacked and killed while grazing goats near the village fields.,https://timesofindia.indiatimes.com/city/raipur/minor-girl-man-mauled-to-death-by-sloth-bear/articleshow/113771475.cms,,,,,,,,,,,,,,,,,,,,,,,,,,,,,,,,,,,,,,,,,,,,,,,,
331,28-09-2024,Sloth Bear,Forest Area,GPM District,Chhattisgarh,,Dead,"In a separate incident on the same day, a man collecting forest produce was attacked and killed",https://timesofindia.indiatimes.com/city/raipur/minor-girl-man-mauled-to-death-by-sloth-bear/articleshow/113771475.cms,,,,,,,,,,,,,,,,,,,,,,,,,,,,,,,,,,,,,,,,,,,,,,,,
332,27-08-2025,Sloth Bear,Turunga,Jajpur,Odisha,27yr,Dead,Victim attacked while attending nature's call in a forest patch. Succumbed to injuries later,https://timesofindia.indiatimes.com/city/bhubaneswar/man-from-jajpur-district-dies-days-after-getting-injured-in-sloth-bear-attack/articleshow/123837806.cms,,,,,,,,,,,,,,,,,,,,,,,,,,,,,,,,,,,,,,,,,,,,,,,,
333,28-01-2023,Sloth Bear,Naliadaba,Jajpur,Odisha,65yr,injured,Elderly man fought off a bear with a bamboo stick for several minutes and survived,https://timesofindia.indiatimes.com/city/bhubaneswar/man-fights-off-sloth-bear-with-bamboo-stick-in-odisha/articleshow/97434803.cms,,,,,,,,,,,,,,,,,,,,,,,,,,,,,,,,,,,,,,,,,,,,,,,,
334,27-10-2024,Sloth Bear,Bijora,Balaghat,Madhya Pradesh,,Animal Deceased,"Bear died after biting a ""crude bomb"" (meat coated explosive) meant for wild boars.",https://timesofindia.indiatimes.com/city/bhopal/tragic-death-of-sloth-bear-after-consuming-crude-bomb-in-balaghat-forest/articleshow/114634280.cms,,,,,,,,,,,,,,,,,,,,,,,,,,,,,,,,,,,,,,,,,,,,,,,,
335,07-10-2024,Sloth Bear,Kallusadarahalli,Hassan,Karnataka,,Dead,Three sloth bears (including a cub) were electrocuted by a live wire in a farmland,https://www.thehindu.com/news/national/karnataka/three-sloth-bears-electrocuted-in-arsikere/article68732147.ece,,,,,,,,,,,,,,,,,,,,,,,,,,,,,,,,,,,,,,,,,,,,,,,,
336,05-12-2024,Sloth Bear,Maan,Belagavi,Karnataka,63yr,injured,Farmer grievously injured while walking to his fields near the Goa-Karnataka border.,https://timesofindia.indiatimes.com/city/goa/sloth-bear-mauls-man-on-goa-ktaka-border/articleshow/116018055.cms,,,,,,,,,,,,,,,,,,,,,,,,,,,,,,,,,,,,,,,,,,,,,,,,
337,17-12-2023,Sloth Bear,Kanha Tiger Reserve,Balaghat,Madhya Pradesh,30yr,injured,A forest guard and a watcher were attacked on patrol. The watcher was mauled while trying to save the guard.,https://indianmasterminds.com/news/sloth-bear-attacks-forest-staff-in-kanha-tiger-reserve-guard-watcher-hospitalised/,,,,,,,,,,,,,,,,,,,,,,,,,,,,,,,,,,,,,,,,,,,,,,,,
338,17-12-2023,Sloth Bear,Kanha Tiger Reserve,Balaghat,Madhya Pradesh,40yr,injured,A forest guard and a watcher were attacked on patrol. The watcher was mauled while trying to save the guard.,https://indianmasterminds.com/news/sloth-bear-attacks-forest-staff-in-kanha-tiger-reserve-guard-watcher-hospitalised/,,,,,,,,,,,,,,,,,,,,,,,,,,,,,,,,,,,,,,,,,,,,,,,,
339,23-06-2023,Sloth Bear,Thimboli (Ramanagara),Uttara Kannada,Karnataka,65yr,injured,Victim took a forest shortcut during the day. Walked back to the village holding his injured eye.,https://www.newindianexpress.com/states/karnataka/2023/Jun/23/65-year-old-man-sustains-serious-injuries-after-being-attacked-by-sloth-bear-in-karnataka-2587682.html,,,,,,,,,,,,,,,,,,,,,,,,,,,,,,,,,,,,,,,,,,,,,,,,
340,16-12-2022,Sloth Bear,Lavaria,Panchmahal,Gujarat,,injured,"A single bear strayed into a village to eat berries. Villagers cornered it, and it attacked 5 people in defense.",https://indianexpress.com/article/cities/five-injured-in-bear-attack-in-panchmahal-8327292/,,,,,,,,,,,,,,,,,,,,,,,,,,,,,,,,,,,,,,,,,,,,,,,,
341,03-11-2022,Sloth Bear,Muduchekkalapally,Warangal,Telangana,58yr,injured,Farmer attacked in his field at dawn. Neighbors drove the bear away with loud noises.,https://www.newindianexpress.com/states/telangana/2022/Nov/03/sloth-bear-attacks-injures-warangal-farmer-in-telangana-2514332.html,,,,,,,,,,,,,,,,,,,,,,,,,,,,,,,,,,,,,,,,,,,,,,,,
342,07-11-2022,Sloth Bear,Forest Area,Tenkasi,Tamil Nadu,,injured,One man attacked; two rescuers also seriously injured. Incident caught on camera.,https://www.thehindu.com/news/cities/Coimbatore/boy-injured-in-sloth-bear-attack-near-valparai/article37990217.ece,,,,,,,,,,,,,,,,,,,,,,,,,,,,,,,,,,,,,,,,,,,,,,,,
343,18-12-2021,Sloth Bear,Upper Sholayar Dam,Coimbatore,Tamil nadu,16yr,injured,A teenager ventured out of his quarters at 10:45 PM and was attacked by a bear near the dam,https://www.thehindu.com/news/cities/Coimbatore/boy-injured-in-sloth-bear-attack-near-valparai/article37990217.ece,,,,,,,,,,,,,,,,,,,,,,,,,,,,,,,,,,,,,,,,,,,,,,,,
344,31-03-2021,Sloth Bear,Anekal / Attibele,Bangalore Urban,Karnataka,,injured,": A single ""rabid"" bear went on a rampage over 48 hours, attacking 6 people across multiple villages near Bangalore.",https://www.newindianexpress.com/cities/bengaluru/2021/Mar/31/sloth-bear-on-prowl-near-bengaluru-alert-issued-upto-tamil-nadushosur-2283759.html,,,,,,,,,,,,,,,,,,,,,,,,,,,,,,,,,,,,,,,,,,,,,,,,
345,31-03-2021,Sloth Bear,Anekal / Attibele,Bangalore Urban,Karnataka,,injured,": A single ""rabid"" bear went on a rampage over 48 hours, attacking 6 people across multiple villages near Bangalore.",https://www.newindianexpress.com/cities/bengaluru/2021/Mar/31/sloth-bear-on-prowl-near-bengaluru-alert-issued-upto-tamil-nadushosur-2283759.html,,,,,,,,,,,,,,,,,,,,,,,,,,,,,,,,,,,,,,,,,,,,,,,,
346,31-03-2021,Sloth Bear,Anekal / Attibele,Bangalore Urban,Karnataka,,injured,": A single ""rabid"" bear went on a rampage over 48 hours, attacking 6 people across multiple villages near Bangalore.",https://www.newindianexpress.com/cities/bengaluru/2021/Mar/31/sloth-bear-on-prowl-near-bengaluru-alert-issued-upto-tamil-nadushosur-2283759.html,,,,,,,,,,,,,,,,,,,,,,,,,,,,,,,,,,,,,,,,,,,,,,,,
347,31-03-2021,Sloth Bear,Anekal / Attibele,Bangalore Urban,Karnataka,,injured,": A single ""rabid"" bear went on a rampage over 48 hours, attacking 6 people across multiple villages near Bangalore.",https://www.newindianexpress.com/cities/bengaluru/2021/Mar/31/sloth-bear-on-prowl-near-bengaluru-alert-issued-upto-tamil-nadushosur-2283759.html,,,,,,,,,,,,,,,,,,,,,,,,,,,,,,,,,,,,,,,,,,,,,,,,
348,31-03-2021,Sloth Bear,Anekal / Attibele,Bangalore Urban,Karnataka,,injured,": A single ""rabid"" bear went on a rampage over 48 hours, attacking 6 people across multiple villages near Bangalore.",https://www.newindianexpress.com/cities/bengaluru/2021/Mar/31/sloth-bear-on-prowl-near-bengaluru-alert-issued-upto-tamil-nadushosur-2283759.html,,,,,,,,,,,,,,,,,,,,,,,,,,,,,,,,,,,,,,,,,,,,,,,,
349,31-03-2021,Sloth Bear,Anekal / Attibele,Bangalore Urban,Karnataka,,injured,": A single ""rabid"" bear went on a rampage over 48 hours, attacking 6 people across multiple villages near Bangalore.",https://www.newindianexpress.com/cities/bengaluru/2021/Mar/31/sloth-bear-on-prowl-near-bengaluru-alert-issued-upto-tamil-nadushosur-2283759.html,,,,,,,,,,,,,,,,,,,,,,,,,,,,,,,,,,,,,,,,,,,,,,,,
15-12-1900,05-03-2021,Sloth Bear,Forest Area,Chandrapur,Maharashtra,,injured,A complex conflict event involving both a tiger (killed one) and a sloth bear (injured two) in the same area.,https://www.ndtv.com/topic/sloth-bear-attack,,,,,,,,,,,,,,,,,,,,,,,,,,,,,,,,,,,,,,,,,,,,,,,,
